{"id":"TASK-000","title":"Create harmless agent report","version":1,"status":"PENDING","priority":"LOW","createdBy":"chatgpt","assignedTo":"hy3","reviewer":"codex-sol","goal":"Create ai/reports/hello-agent.md","background":"Demonstrate the task protocol without touching game code.","requirements":["Create ai/reports/hello-agent.md containing a short greeting."],"acceptanceCriteria":["The report exists and contains hello-agent."],"allowedPaths":["ai/reports/hello-agent.md"],"forbiddenPaths":[".git/**","settings/**"],"commands":{"install":"","build":"","test":"","lint":""},"constraints":[],"references":[],"maxReviewRounds":3}
