{
  "id": "TASK-005",
  "title": "实现牛马生成系统",
  "version": 1,
  "status": "DONE",
  "priority": "HIGH",
  "createdBy": "chatgpt-gpt-5.6-sol",
  "assignedTo": "codex-gpt-5.6-luna",
  "reviewer": "codex-gpt-5.6-sol",
  "goal": "实现 RecruitmentService：免费生成 Lv1 Worker 并放入首个空格。",
  "background": "Phase 1 core demo task 005; depends on TASK-004 being DONE.",
  "requirements": [
    "实现 RecruitmentService：免费生成 Lv1 Worker 并放入首个空格。",
    "满棋盘返回工位满了提示，不覆盖 Worker。",
    "每次成功生成触发保存与模型事件。"
  ],
  "acceptanceCriteria": [
    "连续生成不会产生重复 ID。",
    "满棋盘数据保持不变。",
    "招聘测试通过。"
  ],
  "allowedPaths": [
    "assets/scripts/services/recruitment-service.ts",
    "assets/scripts/core/game-context.ts",
    "assets/scripts/core/game-events.ts",
    "tests/recruitment/**"
  ],
  "forbiddenPaths": [
    ".git/**",
    "ai/tasks/**",
    "ai/logs/**",
    "tools/orchestrator/**",
    "docs/**"
  ],
  "commands": {
    "install": "",
    "build": "npm run build",
    "test": "npm test",
    "lint": ""
  },
  "constraints": [
    "Use real Codex Luna Developer and Codex Sol Reviewer.",
    "Do not implement Phase 2 features.",
    "Do not claim Cocos Editor validation without launching the Editor.",
    "Keep domain state independent from UI nodes."
  ],
  "references": [
    "AGENTS.md",
    "docs/superpowers/specs/2026-08-20-phase-1-core-demo-design.md",
    "docs/superpowers/plans/2026-08-20-phase-1-core-demo.md"
  ],
  "maxReviewRounds": 3
}