{
  "id": "TASK-004",
  "title": "实现 4×4 合成棋盘",
  "version": 1,
  "status": "DONE",
  "priority": "HIGH",
  "createdBy": "chatgpt-gpt-5.6-sol",
  "assignedTo": "codex-gpt-5.6-luna",
  "reviewer": "codex-gpt-5.6-sol",
  "goal": "实现 MergeBoard、MergeCell、WorkerEntity 与唯一 Worker ID。",
  "background": "Phase 1 core demo task 004; depends on TASK-003 being DONE.",
  "requirements": [
    "实现 MergeBoard、MergeCell、WorkerEntity 与唯一 Worker ID。",
    "支持放置、移动、占用、合成判定、空格、满棋盘、序列化和恢复。",
    "棋盘尺寸来自配置，领域模型不得依赖 Cocos Node。"
  ],
  "acceptanceCriteria": [
    "默认 16 格且不重复占用。",
    "不同等级不能合并，最高等级边界可判断。",
    "Board 测试通过。"
  ],
  "allowedPaths": [
    "assets/scripts/model/worker-entity.ts",
    "assets/scripts/game/merge/**",
    "tests/board/**"
  ],
  "forbiddenPaths": [
    ".git/**",
    "ai/tasks/**",
    "ai/logs/**",
    "tools/orchestrator/**",
    "docs/**"
  ],
  "commands": {
    "install": "",
    "build": "npm run build",
    "test": "npm test",
    "lint": ""
  },
  "constraints": [
    "Use real Codex Luna Developer and Codex Sol Reviewer.",
    "Do not implement Phase 2 features.",
    "Do not claim Cocos Editor validation without launching the Editor.",
    "Keep domain state independent from UI nodes."
  ],
  "references": [
    "AGENTS.md",
    "docs/superpowers/specs/2026-08-20-phase-1-core-demo-design.md",
    "docs/superpowers/plans/2026-08-20-phase-1-core-demo.md"
  ],
  "maxReviewRounds": 3
}