{
  "id": "TASK-010",
  "title": "实现基础游戏反馈",
  "version": 1,
  "status": "PENDING",
  "priority": "HIGH",
  "createdBy": "chatgpt-gpt-5.6-sol",
  "assignedTo": "codex-gpt-5.6-luna",
  "reviewer": "codex-gpt-5.6-sol",
  "goal": "实现 ToastView、合成缩放闪烁、工资飞字与新等级突破提示。",
  "background": "Phase 1 core demo task 010; depends on TASK-009 being DONE.",
  "requirements": [
    "实现 ToastView、合成缩放闪烁、工资飞字与新等级突破提示。",
    "使用 Cocos Tween，不引入第三方动画框架。",
    "销毁/失效时停止 Tween，工位满显示 Toast。"
  ],
  "acceptanceCriteria": [
    "反馈不改变领域状态。",
    "Tween 生命周期和事件解绑安全。",
    "反馈静态测试与 build 通过。"
  ],
  "allowedPaths": [
    "assets/scripts/ui/toast-view.ts",
    "assets/scripts/ui/feedback-view.ts",
    "assets/scripts/ui/main-view.ts",
    "assets/scenes/Main.scene",
    "assets/prefabs/**",
    "tests/ui/**"
  ],
  "forbiddenPaths": [
    ".git/**",
    "ai/tasks/**",
    "ai/logs/**",
    "tools/orchestrator/**",
    "docs/**"
  ],
  "commands": {
    "install": "",
    "build": "npm run build",
    "test": "npm test",
    "lint": ""
  },
  "constraints": [
    "Use real Codex Luna Developer and Codex Sol Reviewer.",
    "Do not implement Phase 2 features.",
    "Do not claim Cocos Editor validation without launching the Editor.",
    "Keep domain state independent from UI nodes."
  ],
  "references": [
    "AGENTS.md",
    "docs/superpowers/specs/2026-08-20-phase-1-core-demo-design.md",
    "docs/superpowers/plans/2026-08-20-phase-1-core-demo.md"
  ],
  "maxReviewRounds": 3
}
