{
  "id": "TASK-023",
  "title": "实现道心系统",
  "version": 1,
  "status": "DONE",
  "priority": "HIGH",
  "createdBy": "chatgpt-gpt-5.6-sol",
  "assignedTo": "codex-gpt-5.6-luna",
  "reviewer": "codex-gpt-5.6-sol",
  "forbiddenPaths": [
    ".git/**",
    "ai/tasks/**",
    "ai/logs/**",
    "tools/orchestrator/**",
    "docs/**"
  ],
  "commands": {
    "install": "",
    "build": "npm run build",
    "test": "npm test",
    "lint": "npm run ai:check"
  },
  "constraints": [
    "Use real Codex Luna Developer and Codex Sol Reviewer; never use Mock.",
    "Do not implement Phase 3 or prohibited systems such as real ads, backend, friends, rankings, store, skins, payments or cloud saves.",
    "Do not claim Cocos Editor validation unless the Editor is actually launched.",
    "All state changes must go through services and critical save failures must not leave memory ahead of persistence."
  ],
  "references": [
    "AGENTS.md",
    "ai/reports/PHASE-1.1-RESULT.md"
  ],
  "maxReviewRounds": 3,
  "goal": "实现 MindService、0~100 clamp、状态文案、BREAKDOWN、休息与 Mock 奖励恢复接口。",
  "background": "Phase 2 sequential task TASK-023; depends on TASK-022 being DONE, except TASK-020 which depends on Phase 1.1 PASS.",
  "requirements": [
    "默认 mind/maxMind=100，所有变更服务化并自动保存、失败回滚。",
    "BREAKDOWN 可休息恢复或通过 MockRewardProvider 恢复 50，不接真实广告。"
  ],
  "acceptanceCriteria": [
    "默认 mind/maxMind=100，所有变更服务化并自动保存、失败回滚。",
    "BREAKDOWN 可休息恢复或通过 MockRewardProvider 恢复 50，不接真实广告。"
  ],
  "allowedPaths": [
    "assets/configs/**",
    "assets/scripts/model/**",
    "assets/scripts/core/**",
    "assets/scripts/services/mind-service.ts",
    "assets/scripts/services/reward-provider.ts",
    "tests/mind/**",
    "tests/reward/**"
  ]
}